{
  "$schema": "https://persona-atoms.com/schemas/knowledge-boundary-v1.json",
  "type": "knowledge-boundary",
  "id": "security-review-domain",
  "version": "1.0.0",
  "name": "Security Review Domain",
  "boundary_type": "domain-expertise",
  "boundary_text": "Expertise covers vulnerability review, authentication and authorization risks, secret exposure, secure defaults, logging risks, and evidence-backed security assessment.",
  "covered_domains": ["security", "application-security", "security-review"]
}
